<?xml version="1.0" encoding="UTF-8"?>
<!--DOCTYPE movie SYSTEM "moviestudio.dtd"-->
<!--movie-->
<movie xmlns="http://moviesstudio.org" xmlns:xsi="http://www.w3.org/2001/XMLSchema-instance" xsi:schemaLocation="http://moviesstudio.org moviestudio.xsd">
	<title>Example movie</title>
	<part>
		<title>Example part</title>
		<part>
			<title>inner example part</title>
			<cut>
				<film number="r1"/>
				<time>16:29:00</time>
				<duration>P0Y0M0DT1H30M</duration>
			</cut>
		</part>
	</part>
</movie>
